{
  "finding_id": "f_YsmRj3Og_ent",
  "workflow_id": "YsmRj3OgBSjVBv0o",
  "workflow_name": "Support ticket triage",
  "node_id": "b0000000-0000-4000-8000-000000000002",
  "node_name": "Classify ticket",
  "rule": "low_entropy_output",
  "severity": "cut",
  "title": "Ce noeud LLM est un aiguillage deguise en agent",
  "evidence": {
    "calls": 125,
    "distinct_outputs": 4,
    "entropy_bits": 1.76,
    "max_entropy_bits": 6.97,
    "output_distribution": {
      "billing": 47,
      "technical": 46,
      "account": 25,
      "other": 7
    },
    "samples": [
      {
        "input": "Bonjour, Je souhaite changer de formule de paiement Pouvez-vous m'aider ?",
        "output": "billing"
      },
      {
        "input": "Bonsoir, Le prelevement du 91 n'est jamais passe C'est urgent.",
        "output": "billing"
      },
      {
        "input": "Bonjour, Mon abonnement a ete debite deux fois ce mois-ci Cordialement.",
        "output": "billing"
      },
      {
        "input": "Bonjour, Le bouton d'export ne fait rien depuis la mise a jour Cordialement.",
        "output": "technical"
      },
      {
        "input": "Je veux un remboursement sur la facture de octobre Cordialement.",
        "output": "billing"
      },
      {
        "input": "Bonsoir, Le site est tres lent depuis 368 jours Pouvez-vous m'aider ?",
        "output": "technical"
      },
      {
        "input": "Bonsoir, Erreur 86 au chargement de la page export Pouvez-vous m'aider ?",
        "output": "technical"
      },
      {
        "input": "Bonjour, Le paiement a echoue 165 fois, la carte est pourtant valide Pouvez-vous m'aider ?",
        "output": "billing"
      },
      {
        "input": "Salut, La page reste blanche apres la connexion Pouvez-vous m'aider ?",
        "output": "technical"
      },
      {
        "input": "Bonjour, Je n'ai jamais recu l'email de confirmation",
        "output": "account"
      },
      {
        "input": "Salut, Je n'ai jamais recu l'email de confirmation Merci d'avance.",
        "output": "account"
      },
      {
        "input": "Salut, Je n'ai jamais recu l'email de confirmation C'est urgent.",
        "output": "account"
      },
      {
        "input": "Comment obtenir une facture au nom de ma societe ? Pouvez-vous m'aider ?",
        "output": "billing"
      },
      {
        "input": "Bonsoir, Je n'arrive pas a telecharger ma facture de octobre C'est urgent.",
        "output": "billing"
      },
      {
        "input": "Je veux un remboursement sur la facture de avril Cordialement.",
        "output": "billing"
      },
      {
        "input": "Bonjour, Le prelevement du 257 n'est jamais passe Merci d'avance.",
        "output": "billing"
      },
      {
        "input": "Salut, Je veux transferer la propriete du compte Pouvez-vous m'aider ?",
        "output": "account"
      },
      {
        "input": "Bonjour, Le paiement a echoue 329 fois, la carte est pourtant valide C'est urgent.",
        "output": "billing"
      },
      {
        "input": "Salut, Je souhaite changer de formule de paiement Pouvez-vous m'aider ?",
        "output": "billing"
      },
      {
        "input": "Mon abonnement a ete debite deux fois ce mois-ci C'est urgent.",
        "output": "billing"
      },
      {
        "input": "Salut, Comment activer la double authentification ? C'est urgent.",
        "output": "technical"
      },
      {
        "input": "Salut, Avez-vous une version mobile prevue ? Pouvez-vous m'aider ?",
        "output": "other"
      },
      {
        "input": "Salut, La page reste blanche apres la connexion C'est urgent.",
        "output": "technical"
      },
      {
        "input": "Bonjour, Les donnees ne se synchronisent plus depuis decembre",
        "output": "technical"
      },
      {
        "input": "Bonjour, Le bouton d'export ne fait rien depuis la mise a jour Cordialement.",
        "output": "technical"
      },
      {
        "input": "Bonsoir, Un bug affiche des chiffres faux dans le rapport Merci d'avance.",
        "output": "technical"
      },
      {
        "input": "Mon compte semble bloque depuis novembre Merci d'avance.",
        "output": "account"
      },
      {
        "input": "Salut, Je veux supprimer mon compte definitivement C'est urgent.",
        "output": "account"
      },
      {
        "input": "Bonjour, Le site est tres lent depuis 223 jours C'est urgent.",
        "output": "technical"
      },
      {
        "input": "Bonjour, Comment ajouter un collegue a mon espace ? Merci d'avance.",
        "output": "account"
      },
      {
        "input": "Erreur 238 au chargement de la page export Merci d'avance.",
        "output": "technical"
      },
      {
        "input": "Bonjour, Impossible de reinitialiser mon mot de passe C'est urgent.",
        "output": "account"
      },
      {
        "input": "Bonsoir, Ou puis-je trouver votre documentation ?",
        "output": "other"
      },
      {
        "input": "Bonsoir, Bonjour, je voulais juste vous feliciter pour le produit Cordialement.",
        "output": "other"
      },
      {
        "input": "Comment ajouter un collegue a mon espace ? Merci d'avance.",
        "output": "account"
      },
      {
        "input": "Je n'ai jamais recu l'email de confirmation Merci d'avance.",
        "output": "account"
      },
      {
        "input": "Bonjour, Je veux supprimer mon compte definitivement",
        "output": "account"
      },
      {
        "input": "Bonjour, L'upload de fichier echoue systematiquement Pouvez-vous m'aider ?",
        "output": "technical"
      },
      {
        "input": "Bonjour, Mon compte semble bloque depuis mars",
        "output": "account"
      },
      {
        "input": "Salut, Ou puis-je trouver votre documentation ? Merci d'avance.",
        "output": "other"
      },
      {
        "input": "Salut, Ou puis-je trouver votre documentation ? Cordialement.",
        "output": "other"
      },
      {
        "input": "Bonjour, Comment activer la double authentification ?",
        "output": "other"
      },
      {
        "input": "Bonsoir, Avez-vous une version mobile prevue ? Pouvez-vous m'aider ?",
        "output": "other"
      }
    ]
  },
  "proposed_action": "Remplacer par un Switch deterministe, avec un petit modele en fallback pour les cas non couverts"
}